{
  "$schema": "http://json-schema.org/draft-07/schema#",
  "title": "BloggerUpdates",
  "description": "Structured output from collect-blogger-updates skill.",
  "type": "object",
  "required": ["schema_version", "generated_at", "status", "source", "coverage", "errors", "data"],
  "properties": {
    "schema_version": { "type": "string", "const": "1.0" },
    "generated_at": { "type": "string", "pattern": "^\\d{4}-\\d{2}-\\d{2}T\\d{2}:\\d{2}:\\d{2}[+-]\\d{2}:\\d{2}$" },
    "status": { "type": "string", "enum": ["complete", "partial", "failed"] },
    "source": {
      "type": "object",
      "required": ["skill", "commands"],
      "properties": {
        "skill": { "type": "string", "const": "collect-blogger-updates" },
        "commands": { "type": "array", "items": { "type": "string" } }
      }
    },
    "coverage": {
      "type": "object",
      "required": ["requested", "succeeded", "failed"],
      "properties": {
        "requested": { "type": "integer", "minimum": 0 },
        "succeeded": { "type": "integer", "minimum": 0 },
        "failed": { "type": "integer", "minimum": 0 }
      }
    },
    "errors": { "type": "array", "items": { "type": "string" } },
    "data": {
      "type": "object",
      "properties": {
        "bloggers": {
          "type": "array",
          "items": {
            "type": "object",
            "required": ["username", "name", "tweets"],
            "properties": {
              "username": { "type": "string" },
              "name": { "type": "string" },
              "tweets": {
                "type": "array",
                "items": {
                  "type": "object",
                  "required": ["id", "text", "created_at"],
                  "properties": {
                    "id": { "type": "string" },
                    "text": { "type": "string" },
                    "created_at": { "type": "string" },
                    "url": { "type": "string" },
                    "likes": { "type": "integer" },
                    "retweets": { "type": "integer" }
                  }
                }
              }
            }
          }
        }
      }
    }
  }
}