{
  "schema_version": "1.0",
  "generated_at": "2026-06-07T10:00:00+08:00",
  "status": "partial",
  "source": {
    "skill": "collect-blogger-updates",
    "commands": ["opencli twitter tweets @user --limit 3 -f json"]
  },
  "coverage": { "requested": 2, "succeeded": 1, "failed": 1 },
  "errors": ["Login required for @private_account — skipped"],
  "data": {
    "bloggers": [
      {
        "username": "@user",
        "name": "公开博主",
        "tweets": [
          {"id": "1", "text": "PCB板块值得关注", "created_at": "2026-06-07T09:00:00+08:00", "likes": 30, "retweets": 5}
        ]
      }
    ]
  }
}